{
  "account_id": "ACC-003",
  "company_name": "Bolt Electric Services",
  "version": "v1",
  "created_at": "2026-03-03T15:18:09.835144+00:00",
  "updated_at": null,
  "source": "demo_call",
  "business_hours": {
    "days": [
      "Monday",
      "Tuesday",
      "Wednesday",
      "Thursday",
      "Friday"
    ],
    "start": "07:00",
    "end": "16:00",
    "timezone": "America/Denver",
    "notes": null
  },
  "office_address": {
    "full": "9400 N. 19th Avenue, Suite 200, Phoenix, AZ 85021",
    "street": "9400 N. 19th Avenue",
    "city": "Suite 200",
    "state": "AZ",
    "zip": "85021"
  },
  "services_supported": [
    "Electrical",
    "Electrician",
    "Wiring",
    "Panel"
  ],
  "emergency_definition": [
    "power outage",
    "electrical fire",
    "arcing",
    "exposed wiring",
    "panel failure",
    "safety risk",
    "immediate danger"
  ],
  "emergency_routing_rules": {
    "primary_contact": null,
    "primary_phone": "602-555-0444",
    "secondary_contact": "James",
    "secondary_phone": "602-555-0512",
    "fallback": "Last resort \u2014 tell the caller to call 911 if there's immediate danger, and that we'll have someone there within 2 hours otherwise",
    "order": [
      "602-555-0444",
      "602-555-0512",
      "602-555-0400"
    ]
  },
  "non_emergency_routing_rules": null,
  "call_transfer_rules": {
    "timeout_seconds": null,
    "retries": 2,
    "what_to_say_if_transfer_fails": null,
    "transfer_announcement": "One moment, I'm connecting you with our scheduling team"
  },
  "integration_constraints": [
    "never create jobs for residential service \u2014 we only do commercial and industrial"
  ],
  "after_hours_flow_summary": "After hours, the agent confirms whether the issue is an emergency. Emergency calls are immediately routed to on-call staff. Non-emergency calls receive a message-taking flow with a next-business-day callback promise.",
  "office_hours_flow_summary": "During business hours (Monday, Tuesday, Wednesday, Thursday, Friday 07:00\u201316:00 Denver), calls are answered and routed to the main office or scheduling desk. If transfer fails, a message is taken and callback is promised.",
  "questions_or_unknowns": null,
  "notes": "Extracted from demo_call transcript via rule-based engine.",
  "extraction_confidence": {
    "company_name": "high",
    "business_hours": "high",
    "emergency_definition": "high",
    "emergency_routing_rules": "high",
    "call_transfer_rules": "medium"
  }
}