{
  "account_id": "ACC-002",
  "company_name": "Clearflow Plumbing & Drain",
  "version": "v1",
  "created_at": "2026-03-04T19:54:39.478285+00:00",
  "updated_at": null,
  "source": "demo_call",
  "business_hours": {
    "days": [
      "Monday",
      "Tuesday",
      "Wednesday",
      "Thursday",
      "Friday"
    ],
    "start": "08:00",
    "end": "17:00",
    "timezone": "America/Chicago",
    "notes": null
  },
  "office_address": {
    "full": "1120 Cesar Chavez Street, Austin, TX 78702",
    "street": "1120 Cesar Chavez Street",
    "city": "Austin",
    "state": "TX",
    "zip": "78702"
  },
  "services_supported": [
    "Plumbing",
    "Drain",
    "Drain Cleaning",
    "Water Heater",
    "Sewage"
  ],
  "emergency_definition": [
    "no hot water",
    "burst pipe",
    "flooding",
    "flood",
    "sewage backup"
  ],
  "emergency_routing_rules": {
    "primary_contact": null,
    "primary_phone": "512-555-0310",
    "secondary_contact": "Dana",
    "secondary_phone": "512-555-0389",
    "fallback": "If both fail, ask the caller to leave their address and phone number and assure them a tech will call back within 30 minutes",
    "order": [
      "512-555-0310",
      "512-555-0389",
      "512-555-0300 ext 9"
    ]
  },
  "non_emergency_routing_rules": {
    "action": "voicemail",
    "voicemail_number": "512-555-0315",
    "callback_promise": null,
    "notes": null
  },
  "call_transfer_rules": {
    "timeout_seconds": 30,
    "retries": null,
    "what_to_say_if_transfer_fails": "If both fail, ask the caller to leave their address and phone number and assure them a tech will call back within 30 minutes",
    "transfer_announcement": "Please hold while I connect you with our team."
  },
  "integration_constraints": [
    "never schedule weekend jobs through ServiceTrade; those are booked manually",
    "do not create any jobs for gas line work \u2014 we're strictly water and drain"
  ],
  "after_hours_flow_summary": "After hours, the agent confirms whether the issue is an emergency. Emergency calls are immediately routed to on-call staff. Non-emergency calls receive a message-taking flow with a next-business-day callback promise.",
  "office_hours_flow_summary": "During business hours (Monday, Tuesday, Wednesday, Thursday, Friday 08:00\u201317:00 Chicago), calls are answered and routed to the main office or scheduling desk. If transfer fails, a message is taken and callback is promised.",
  "questions_or_unknowns": null,
  "notes": "Extracted from demo_call transcript via regex.",
  "extraction_confidence": {
    "company_name": "high",
    "business_hours": "high",
    "emergency_definition": "high",
    "emergency_routing_rules": "high",
    "call_transfer_rules": "high"
  }
}